<?xml version="1.0" encoding="UTF-8" standalone="yes"?>

<project  xmlns="http://www.xml.util.haflow"
xmlns:xsi="http://www.w3.org/2001/XMLSchema-instance"
xsi:schemaLocation="http://www.xml.util.haflow full.xsd">
    <identifier>id</identifier>
	<label>name</label>
    
    <items>
        <id>EntryFlow_id</id>
        <name>EntryFlow</name>
		<type>FLOW</type>        
		<tabid>tab_EntryFlow_id</tabid>
		<erModule>
			<id>pid1-entryFlow1-0</id>
			<name>ER</name>
			<_type>String</_type>
			<mtype>ER-MODULE</mtype>
			<erProperties>
				<jarPath>jar</jarPath>
				<inputPath>input</inputPath>
				<outputPath>output</outputPath>
				<confPath>conf</confPath>
			</erProperties>
			<position>
				<x>100</x>
				<y>200</y>
			</position>
		</erModule>

	</items>
    <items>
        <id>HiveFlow_id</id>
        <name>HiveFlow</name>
		<type>SUBFLOW</type>        		
		<tabid>tab_HiveFlow_id</tabid>
    </items>
	<items>
        <id>aa_id</id>
        <name>aa</name>
        <type>FLOW</type>
        <tabid>tab_aa_id</tabid>
    </items>
</project>